{
  "$schema": "https://json-schema.org/draft/2020-12/schema",
  "$id": "https://assetlibrary.neuro.local/schemas/art-manifest.schema.json",
  "title": "Loom Art package manifest",
  "type": "object",
  "required": ["id", "name", "description", "enabled", "execution", "inputs", "outputs", "params", "metadata"],
  "properties": {
    "id": { "$ref": "#/$defs/localId" },
    "name": { "type": "string", "minLength": 1, "maxLength": 128 },
    "description": { "type": "string", "maxLength": 4096 },
    "enabled": { "type": "boolean" },
    "execution": {
      "type": "object",
      "required": ["type", "framework"],
      "properties": {
        "type": { "const": "framework_art" },
        "framework": { "$ref": "#/$defs/packageReference" }
      },
      "additionalProperties": false
    },
    "inputs": { "type": "array", "maxItems": 256 },
    "outputs": { "type": "array", "maxItems": 256 },
    "params": { "type": "array", "maxItems": 256 },
    "metadata": {
      "type": "object",
      "required": ["packageSecurity", "art", "dependencies"],
      "properties": {
        "packageSecurity": { "$ref": "#/$defs/packageSecurity" },
        "art": { "$ref": "#/$defs/artIdentity" },
        "dependencies": { "$ref": "#/$defs/dependencies" },
        "capabilities": {
          "type": "object",
          "properties": { "surface": { "$ref": "#/$defs/surface" } },
          "additionalProperties": true
        },
        "localization": { "$ref": "#/$defs/metadataExtension" },
        "marketData": { "$ref": "#/$defs/metadataExtension" },
        "mcp": { "$ref": "#/$defs/metadataExtension" },
        "cloud": { "$ref": "#/$defs/metadataExtension" },
        "plugin": { "$ref": "#/$defs/metadataExtension" },
        "python": { "$ref": "#/$defs/metadataExtension" }
      },
      "additionalProperties": false
    }
  },
  "$defs": {
    "localId": {
      "type": "string",
      "minLength": 1,
      "maxLength": 128,
      "pattern": "^[a-z0-9][a-z0-9._-]*$"
    },
    "publisherId": {
      "type": "string",
      "minLength": 1,
      "maxLength": 128,
      "pattern": "^[a-z0-9][a-z0-9.-]*$"
    },
    "packageReference": {
      "type": "string",
      "minLength": 1,
      "maxLength": 257,
      "pattern": "^[a-z0-9][a-z0-9._-]*(?:/[a-z0-9][a-z0-9._-]*)?$"
    },
    "semver": {
      "type": "string",
      "maxLength": 128,
      "pattern": "^(0|[1-9][0-9]*)\\.(0|[1-9][0-9]*)\\.(0|[1-9][0-9]*)(?:-[0-9A-Za-z.-]+)?(?:\\+[0-9A-Za-z.-]+)?$"
    },
    "relativePath": {
      "type": "string",
      "minLength": 1,
      "maxLength": 1024,
      "pattern": "^(?![A-Za-z]:)(?!/)(?!.*(?:^|/)\\.\\.(?:/|$))[A-Za-z0-9._/-]+$"
    },
    "packageSecurity": {
      "type": "object",
      "required": ["version", "publisher", "signature"],
      "properties": {
        "version": { "$ref": "#/$defs/semver" },
        "publisher": {
          "type": "object",
          "required": ["id", "keyId"],
          "properties": {
            "id": { "$ref": "#/$defs/publisherId" },
            "keyId": { "type": "string", "minLength": 1, "maxLength": 128 },
            "name": { "type": "string", "minLength": 1, "maxLength": 128 },
            "icon": { "type": "string", "maxLength": 4096 }
          },
          "additionalProperties": false
        },
        "signature": {
          "type": "object",
          "required": ["algorithm", "keyId", "file"],
          "properties": {
            "algorithm": { "const": "ed25519" },
            "keyId": { "type": "string", "minLength": 1, "maxLength": 128 },
            "file": { "$ref": "#/$defs/relativePath" }
          },
          "additionalProperties": false
        }
      },
      "additionalProperties": false
    },
    "artIdentity": {
      "type": "object",
      "required": ["qualifiedId"],
      "properties": {
        "qualifiedId": {
          "type": "string",
          "minLength": 3,
          "maxLength": 257,
          "pattern": "^[a-z0-9][a-z0-9.-]*/[a-z0-9][a-z0-9._-]*$"
        },
        "englishName": { "type": "string", "minLength": 1, "maxLength": 128 },
        "globalId": { "type": "string", "minLength": 1, "maxLength": 128 }
      },
      "additionalProperties": false
    },
    "dependencies": {
      "type": "object",
      "required": ["framework"],
      "properties": {
        "framework": { "$ref": "#/$defs/packageReference" },
        "frameworkVersion": { "type": "string", "minLength": 1, "maxLength": 128 },
        "mcpServers": {
          "type": "array",
          "maxItems": 64,
          "items": {
            "type": "object",
            "required": ["id", "version"],
            "properties": {
              "id": { "$ref": "#/$defs/packageReference" },
              "version": { "type": "string", "minLength": 1, "maxLength": 128 }
            },
            "additionalProperties": false
          }
        },
        "arts": {
          "type": "array",
          "maxItems": 64,
          "uniqueItems": true,
          "items": { "$ref": "#/$defs/packageReference" }
        }
      },
      "additionalProperties": false
    },
    "surface": {
      "type": "object",
      "required": ["protocolVersion", "apiVersion", "variants"],
      "properties": {
        "protocolVersion": { "const": "loom.surface.v1" },
        "apiVersion": { "const": "1.0" },
        "variants": {
          "type": "array",
          "minItems": 1,
          "maxItems": 8,
          "items": {
            "type": "object",
            "required": ["runtime", "entry"],
            "properties": {
              "runtime": { "enum": ["javascript", "declarative"] },
              "entry": { "$ref": "#/$defs/relativePath" },
              "requiredCapabilities": {
                "type": "array",
                "maxItems": 64,
                "uniqueItems": true,
                "items": { "type": "string", "minLength": 1, "maxLength": 128 }
              }
            },
            "additionalProperties": false
          }
        },
        "fallbackScene": { "$ref": "#/$defs/relativePath" },
        "requiredNodes": { "$ref": "#/$defs/stringList" },
        "requiredCapabilities": { "$ref": "#/$defs/stringList" },
        "minimumSize": { "$ref": "#/$defs/dimensions" },
        "views": { "type": "array", "maxItems": 64, "items": { "$ref": "#/$defs/metadataExtension" } },
        "defaultViewId": { "type": "string", "minLength": 1, "maxLength": 128 },
        "actions": { "type": "array", "maxItems": 256, "items": { "$ref": "#/$defs/metadataExtension" } },
        "instanceMode": { "type": "string", "minLength": 1, "maxLength": 64 },
        "stateSchemaVersion": { "type": "integer", "minimum": 1 },
        "themeMode": { "type": "string", "minLength": 1, "maxLength": 64 }
      },
      "additionalProperties": false
    },
    "stringList": {
      "type": "array",
      "maxItems": 256,
      "uniqueItems": true,
      "items": { "type": "string", "minLength": 1, "maxLength": 128 }
    },
    "dimensions": {
      "type": "object",
      "required": ["width", "height"],
      "properties": {
        "width": { "type": "integer", "minimum": 1, "maximum": 16384 },
        "height": { "type": "integer", "minimum": 1, "maximum": 16384 }
      },
      "additionalProperties": false
    },
    "metadataExtension": {
      "type": "object",
      "maxProperties": 256
    }
  },
  "additionalProperties": false
}
